{
  "timestamp": "2026-03-08T20:35:00Z",
  "observer": "son-of-anton",
  "observations": {
    "guardian_loop": {
      "baseline_accuracy": 79.3,
      "cycle_count": 2,
      "last_delta": 0.8,
      "status": "healthy",
      "last_run": "2026-03-08T20:00:00Z"
    },
    "meta_loop": {
      "agent_success_rate": 62.0,
      "avg_task_time": 24.0,
      "cycle_count": 1,
      "status": "healthy"
    },
    "infrastructure": {
      "launchd_jobs_active": 3,
      "active_agents": 1,
      "queued_tasks": 2
    }
  },
  "alerts": [
    {
      "severity": "info",
      "category": "guardian_progress",
      "message": "Guardian improved +0.8pp in last cycle",
      "detected_at": "2026-03-08T20:00:15Z"
    }
  ],
  "actions_taken": [
    {
      "action": "posted_status_to_replicants",
      "result": "success",
      "timestamp": "2026-03-08T20:00:30Z"
    }
  ],
  "recommendations": [
    "Continue current strategy - improvement rate is healthy",
    "Monitor for stagnation after 3 more cycles"
  ]
}
